{
  "$schema": "http://json-schema.org/draft-07/schema#",
  "title": "PEV State",
  "type": "object",
  "required": ["objective", "plan_source", "mode", "status", "iteration", "max_iterations"],
  "properties": {
    "status": {
      "type": "string",
      "enum": ["INIT", "PLANNING", "EXECUTING", "VERIFYING", "COMPLETE", "WAITING_FOR_INPUT", "WAITING_FOR_UPSTREAM"]
    },
    "resume_to": {
      "type": "string",
      "description": "仅 status=WAITING_FOR_INPUT 时存在:被阻塞时所处的阶段,用户答复后回到该阶段并清除(由 validate.py 强制)",
      "enum": ["PLANNING", "EXECUTING", "VERIFYING"]
    },
    "mode": {
      "type": "string",
      "description": "implement=按任务清单实施(默认);audit=审计已有实施记录/中断恢复(不走 PLANNING/EXECUTING,直接 VERIFYING)",
      "enum": ["implement", "audit"]
    },
    "plan_source": {
      "type": "string",
      "description": "门槛上游:任务清单路径(.pev/<轮次>/tasks/output/task-plan.md,同轮 tasks/iterations/ 下结构化产物是对账源)或用户提供的任务清单文档。清单本身有错时打回 planning-and-task-breakdown,本 skill 不代改清单"
    },
    "aux_sources": {
      "type": "array",
      "description": "实施遇疑时的设计依据(引用不复制):架构/模块设计/契约/DDL/行为目录",
      "items": {
        "type": "object",
        "required": ["kind", "path"],
        "properties": {
          "kind": {"type": "string", "enum": ["architecture", "module_design", "api_contract", "db_schema", "behavior_catalog", "spec"]},
          "path": {"type": "string"}
        }
      }
    },
    "vcs": {
      "type": "string",
      "description": "目标仓库版本控制:git(默认,done 任务必须有 commit 证据)/ none(无版本控制,测试证据独立承担)",
      "enum": ["git", "none"]
    },
    "upstream_gaps": {
      "type": "array",
      "description": "用户选择回上游的缺口清单;仅 status=WAITING_FOR_UPSTREAM 时允许非空(由 validate.py 强制)",
      "items": {
        "type": "object",
        "required": ["what", "upstream_anchor", "blocks"],
        "properties": {
          "what": {"type": "string", "description": "缺口内容:任务清单本身的错(漏任务/依赖失实/files_touched 严重不符)或设计依据缺失"},
          "upstream_anchor": {"type": "string", "description": "缺口锚定的清单/设计位置,以及该回哪个 skill(planning-and-task-breakdown / architecture-design / module-design / api-and-interface-design / database-schema-design)"},
          "blocks": {"type": "string", "description": "哪些任务因此无法正确执行"},
          "why": {"type": "string"}
        }
      }
    },
    "objective": {
      "type": "object",
      "required": ["goal"],
      "properties": {
        "goal": {"type": "string"},
        "deadline": {"type": ["string", "null"]}
      }
    },
    "evidence": {
      "type": "array",
      "description": "Evidence Ledger",
      "items": {
        "type": "object",
        "required": ["claim", "type", "confidence"],
        "properties": {
          "claim": {"type": "string"},
          "type": {"type": "string", "enum": ["FACT", "INFERENCE", "HYPOTHESIS", "UNKNOWN", "DECISION"]},
          "evidence": {"type": ["string", "null"]},
          "confidence": {"type": "string", "enum": ["high", "medium", "low"]}
        }
      }
    },
    "plans": {"type": "array", "items": {"type": "string"}, "description": "iterations/ 下 plan 文件名登记册,不存内容副本(validate.py R10 对账)"},
    "artifacts": {"type": "array", "items": {"type": "string"}, "description": "iterations/ 下 artifact 文件名登记册,不存内容副本(validate.py R10 对账)"},
    "iteration": {"type": "integer", "minimum": 0},
    "max_iterations": {"type": "integer", "minimum": 1, "default": 5}
  }
}
